{
  "session": {
    "id": "session-1",
    "projectId": "project-1",
    "agentType": "codex",
    "nativeSessionId": "native-1",
    "title": "First session",
    "status": "waiting_user",
    "createdAt": "2026-09-22T00:00:00.000Z",
    "updatedAt": "2026-09-22T00:00:09.000Z"
  },
  "recentEvents": [
    { "id": "e8", "sessionId": "session-1", "sequence": 7, "timestamp": "2026-09-22T00:00:07.000Z", "type": "approval.requested", "interactionId": "i1", "title": "Run command", "actions": ["approve_once", "reject"] },
    { "id": "e9", "sessionId": "session-1", "sequence": 8, "timestamp": "2026-09-22T00:00:08.000Z", "type": "question.requested", "interactionId": "i2", "question": "Choose", "options": [{ "id": "o1", "label": "One" }], "allowFreeText": true },
    { "id": "e10", "sessionId": "session-1", "sequence": 9, "timestamp": "2026-09-22T00:00:09.000Z", "type": "status", "status": "waiting_user", "message": "Waiting" }
  ],
  "pendingInteractions": [
    { "id": "e8", "sessionId": "session-1", "sequence": 7, "timestamp": "2026-09-22T00:00:07.000Z", "type": "approval.requested", "interactionId": "i1", "title": "Run command", "actions": ["approve_once", "reject"] },
    { "id": "e9", "sessionId": "session-1", "sequence": 8, "timestamp": "2026-09-22T00:00:08.000Z", "type": "question.requested", "interactionId": "i2", "question": "Choose", "options": [{ "id": "o1", "label": "One" }], "allowFreeText": true }
  ],
  "latestSequence": 9,
  "currentStatus": "waiting_user"
}
